author_link_karma,time_to_first_comment,post_localTime,author_gold,author_comment_karma,title,author_account_age,title_length,hot,nsfw,serious,post_utcTime
4267,0:00:38,2016-06-03 22:31:08,0,2790,"How did your ""crazy ex"" become your ""crazy ex""?","351 days, 4:56:08",9,1,0,0,2016-06-03 14:31:08
9081,0:03:19,2016-06-03 19:00:38,0,941,"What's your best ""Make a rule"" for drinking games?","1719 days, 16:04:51",9,1,0,0,2016-06-03 11:00:38
4541,0:01:11,2016-06-04 02:53:08,0,17533,What's the strangest thing you've ever found in your home that you have no explanation for?,"185 days, 21:50:53",16,1,0,0,2016-06-03 18:53:08
7486,0:00:25,2016-06-04 02:29:30,0,8697,Why do you hate that one coworker so much?,"1332 days, 23:16:38",9,1,0,0,2016-06-03 18:29:30
1,0:00:00,2016-06-03 15:59:07,0,77,People who started up their own company what are the the Do's and Don't's that you wish you knew before you made your start up?,"327 days, 0:24:26",25,1,0,1,2016-06-03 07:59:07
6348,0:00:14,2016-06-03 22:58:30,0,6995,"Without googling, what do you know about Norway?","381 days, 5:22:49",8,1,0,0,2016-06-03 14:58:30
301,0:00:20,2016-06-04 02:11:59,0,4402,"What has happened to you, that you hope never happens to your kid(s)?","67 days, 16:10:07",13,1,0,0,2016-06-03 18:11:59
1,0:03:23,2016-06-03 13:16:09,0,421,What's the biggest coincidence in history?,"16 days, 13:07:31",6,1,0,0,2016-06-03 05:16:09
1,0:08:14,2016-06-04 06:08:57,1,107,"High school students, what career are you thinking of pursuing? People who work in that industry, what was it like training for/majoring in that field and would you recommend it?","422 days, 22:39:05",30,1,0,0,2016-06-03 22:08:57
5,0:03:04,2016-06-03 20:35:42,0,394,What are some plot holes in Harry Potter?,"720 days, 3:50:53",8,1,0,0,2016-06-03 12:35:42
1,0:02:16,2016-06-04 02:56:48,0,14,What's the most depraved thing you've ever done in the Sims?,"384 days, 15:27:41",11,1,0,0,2016-06-03 18:56:48
1,0:00:51,2016-06-03 14:23:22,1,3659,Beer drinkers of the world. What's your favourite brew?,"175 days, 5:06:54",9,1,0,0,2016-06-03 06:23:22
257,2:09:44,2016-06-04 04:07:04,0,3368,Bosses of Reddit. Have you ever experienced an employee not showing up randomly for days on end and only to discover they died unexpectedly? How did you find out?,"564 days, 5:14:56",29,1,0,0,2016-06-03 20:07:04
32,0:00:30,2016-06-04 02:53:24,1,444,What's that one movie you'll never mind watching over and over?,"724 days, 3:17:00",11,1,0,0,2016-06-03 18:53:24
3724,0:00:40,2016-06-03 14:43:55,0,26375,"Dumpster divers, what's your best find?","1387 days, 16:43:56",6,1,0,0,2016-06-03 06:43:55
1,0:01:00,2016-06-03 14:09:56,1,19868,What technology exists that most people probably don't know about?,"7 days, 16:44:46",10,1,0,0,2016-06-03 06:09:56
308,0:00:29,2016-06-04 02:55:06,0,903,What's your favourite song in another language?,"216 days, 18:03:10",7,1,0,0,2016-06-03 18:55:06
7,0:00:16,2016-06-03 23:24:35,0,10988,What fictional creature would taste the best if eaten?,"408 days, 20:24:05",9,1,0,0,2016-06-03 15:24:35
7638,0:00:28,2016-06-03 23:59:13,0,176,What can you ALWAYS look cool doing?,"328 days, 3:37:45",7,1,0,0,2016-06-03 15:59:13
1,0:00:30,2016-06-04 05:36:21,0,0,What movie terrified you as a kid?,1:46:38,7,1,0,0,2016-06-03 21:36:21
8007,5:48:29,2016-06-03 09:34:43,1,34011,"What's technically legal, but shady as fuck?","77 days, 11:07:25",7,1,0,0,2016-06-03 01:34:43
6257,0:00:31,2016-06-03 16:24:46,1,32145,What is your hometown known for?,"111 days, 6:19:50",6,1,0,0,2016-06-03 08:24:46
3698,0:00:19,2016-06-04 01:01:08,0,13701,What do you hate about reddit?,"923 days, 11:12:31",6,1,0,0,2016-06-03 17:01:08
1,0:00:14,2016-06-04 03:46:33,0,58,"Night owls, what do you do at night when no one else is around?","344 days, 0:33:45",14,1,0,0,2016-06-03 19:46:33
1558,0:01:36,2016-06-04 03:45:13,1,219,The year is 2045. You wake up to realize your body has just been recovered by doctors from a horrible accident. What are some artifical (robotic) features you wish to have in your new cyborg body?,"685 days, 7:07:30",36,1,0,0,2016-06-03 19:45:13
