author_link_karma,time_to_first_comment,post_localTime,author_gold,author_comment_karma,title,author_account_age,title_length,post_id,hot,nsfw,10min_comment,serious,post_utcTime6149,0:00:44,5/2/16 15:35,0,4112,What is a really inappropriate question you have always wanted to ask? ,"66 days, 18:17:08",13,4hguy9,1,1,7,0,5/2/16 7:351961,0:19:46,5/2/16 5:53,1,90,"Parents of Reddit, what is the weirdest thing you've caught your child doing?","672 days, 0:31:55",13,4hdqzw,1,1,0,0,5/1/16 21:53278,0:00:13,5/2/16 14:23,0,10,"Reddit, what is your greatest irrational fear?","21 days, 0:38:02",7,4hgfll,1,0,16,0,5/2/16 6:231,0:00:00,5/2/16 12:02,0,9684,Redditors who have been kidnapped: what was it like and how did you escape?,"514 days, 5:10:01",14,4hfpa2,1,0,1,1,5/2/16 4:029252,0:00:00,5/2/16 18:24,0,9126,Which fictional character do you genuinely feel sorry for?,"688 days, 8:44:42",9,4hhzic,1,0,2,1,5/2/16 10:241392,0:00:00,5/2/16 17:07,0,14773,What's a song that gives you goosebumps or makes you shiver every time you hear it?,"756 days, 11:35:30",16,4hhgrf,1,0,3,1,5/2/16 9:0727568,0:04:31,5/2/16 13:55,0,30594,"Sleepwalkers, what is the strangest incident of you wandering around?","1442 days, 4:07:45",10,4hga70,1,0,3,0,5/2/16 5:5569,0:00:00,5/1/16 22:49,0,868,What are some good brands to avoid due to bad ethics?,"542 days, 8:10:21",11,4hb2nk,1,0,3,1,5/1/16 14:491,0:00:44,5/2/16 6:14,0,57,What's your best story of a moment when someone displayed a complete lack of common sense?,"371 days, 3:57:47",16,4hdvha,1,0,3,0,5/1/16 22:148567,0:46:17,5/1/16 20:00,0,12600,"Relatives of murderers, what memories stand out as red flags?","828 days, 4:02:07",10,4ha0er,1,0,0,0,5/1/16 12:00350,0:02:00,5/2/16 18:43,0,948,What are some historical plot twists?,"965 days, 3:25:01",6,4hi4bc,1,0,1,0,5/2/16 10:431,0:01:26,5/2/16 6:32,0,82,What is a tasty snack that can be eaten in large quantities with little to no weight consequences?,"964 days, 11:39:19",18,4hdz9u,1,0,10,0,5/1/16 22:32106,0:01:00,5/2/16 16:44,0,452,"If immortality did become a thing, which profession would be the most lucrative?","605 days, 14:19:07",13,4hhb2t,1,0,5,0,5/2/16 8:441,0:00:39,5/2/16 14:29,0,91,Apart from using a q-tip to itch you arsehole..... What is a good life hack that you wouldn't want anybody to know it was used by you?,"14 days, 23:14:58",27,4hggo6,1,1,4,0,5/2/16 6:291,0:04:30,5/2/16 14:04,0,1720,"Experienced Redditors, one advice that you would give to the ones who joined very recently?","224 days, 7:52:24",15,4hgbw6,1,0,3,0,5/2/16 6:041,0:01:23,5/2/16 16:42,0,13,How do you keep your passwords organized? Which program/method do you use?,"38 days, 1:33:33",12,4hhaij,1,0,5,0,5/2/16 8:4226,0:03:21,5/2/16 18:07,1,297,"What is a song almost no one knows about, but it's awesome?","419 days, 17:55:38",12,4hhvuf,1,0,5,0,5/2/16 10:07219,0:00:36,5/2/16 15:44,1,5117,Which famous people would you like to see fight to the death?,"321 days, 9:47:00",12,4hgx6w,1,0,9,0,5/2/16 7:441743,0:00:35,5/2/16 16:39,0,7627,What do you wish there was an unlimited supply of?,"99 days, 23:54:09",10,4hh9xl,1,0,7,0,5/2/16 8:393113,0:01:18,5/2/16 1:39,1,540,What is your all-time favorite line from a song?,"226 days, 20:40:50",9,4hc5wq,1,0,8,0,5/1/16 17:39171,0:00:30,5/2/16 14:09,1,3291,What is something that's been taken too far?,"822 days, 14:39:19",8,4hgcv5,1,0,10,0,5/2/16 6:09887,0:00:00,5/2/16 16:02,0,1611,"Redditors who run your own business, what has been the hardest thing you've had to do/experience?","1194 days, 23:27:55",16,4hh1fv,1,0,2,1,5/2/16 8:028,0:00:52,5/2/16 17:34,0,314,What are some etiquette rules people break in public places?,"466 days, 2:07:17",10,4hhn4b,1,0,5,0,5/2/16 9:3440693,0:00:12,5/2/16 19:25,0,8738,What sequel is better than the original?,"1320 days, 18:09:35",7,4hifgq,1,0,10,0,5/2/16 11:258533,0:46:17,5/1/16 20:00,0,12524,"Relatives of murderers, what memories stand out as red flags?","828 days, 4:02:07",10,4ha0er,1,0,0,0,5/1/16 12:0072,0:01:42,5/1/16 15:38,0,1023,What's the funniest gross pick-up line you can think of?,"586 days, 17:26:51",10,4h8v5i,1,0,4,0,5/1/16 7:381,0:00:27,5/1/16 13:43,0,23,What quote do you live by?,"30 days, 13:00:56",6,4h8l5z,1,0,7,0,5/1/16 5:432378,0:01:55,5/1/16 11:51,0,2931,What huge thing happened that almost no one knows about?,"262 days, 22:11:23",10,4h8d11,1,0,2,0,5/1/16 3:51350,0:02:09,5/1/16 16:18,0,567,What is a book everyone must read?,"964 days, 0:59:26",7,4h8zag,1,0,4,0,5/1/16 8:1869,0:00:00,5/1/16 22:49,0,868,What are some good brands to avoid due to bad ethics?,"542 days, 8:10:21",11,4hb2nk,1,0,3,1,5/1/16 14:491012,0:01:43,5/1/16 15:45,0,87,what is your favorite smell?,"1217 days, 15:35:38",5,4h8vtk,1,0,9,0,5/1/16 7:451205,0:00:22,5/1/16 14:06,0,1150,What's one trend you hope dies within this year?,"344 days, 17:14:38",9,4h8mxk,1,0,13,0,5/1/16 6:061730,0:00:41,4/30/16 23:30,1,2854,"What joke is hilarious, but takes a few seconds to get?","89 days, 23:28:35",11,4h629u,1,0,5,0,4/30/16 15:301,0:00:22,5/1/16 17:53,0,4619,What sports would be much more interesting if all the participants have to take 7 shots of vodka before starting?,"197 days, 3:16:33",20,4h9cnu,1,0,9,0,5/1/16 9:53755,0:00:14,5/1/16 15:48,1,2080,What's the best non-sexual feeling in the world?,"21 days, 13:44:12",8,4h8w3x,1,1,15,0,5/1/16 7:4811,0:00:56,5/1/16 10:46,0,404,"""If you could call yourself five years ago and had 30 seconds, what would you say?""","44 days, 22:07:49",16,4h883u,1,0,6,0,5/1/16 2:461789,0:01:08,5/1/16 1:43,0,24192,"Women of reddit, what are the ways you show men you're interested?","695 days, 0:47:16",12,4h6kt9,1,0,6,0,4/30/16 17:436482,0:00:13,5/1/16 21:09,0,14749,What was the worst fast food chain you've eaten at?,"154 days, 10:06:20",10,4haf8d,1,0,7,0,5/1/16 13:0959,0:00:33,5/1/16 21:32,0,335,How do you beat loneliness?,"298 days, 18:48:34",5,4hakda,1,0,10,0,5/1/16 13:321,0:00:47,5/1/16 0:45,1,669,What's the farthest you've gone to impress a crush?,"148 days, 18:58:29",9,4h6cu1,1,0,10,0,4/30/16 16:451,0:01:46,5/1/16 20:48,0,128,"If subreddits were people, which two would have the most interesting fight to the death?","31 days, 19:13:53",15,4haaqk,1,0,1,0,5/1/16 12:481594,0:00:44,5/1/16 21:51,0,876,What's the biggest mistake people make when studying for an exam?,"452 days, 17:42:43",11,4hap3q,1,0,4,0,5/1/16 13:51337,0:00:07,5/1/16 10:04,0,7016,AskReddit announces an unoriginality contest. What do you post/comment in order to win?,"63 days, 3:03:48",13,4h8502,1,0,5,0,5/1/16 2:047,0:00:32,5/1/16 14:57,0,743,"Men of reddit, what are the ways you show women you're interested?","818 days, 4:26:54",12,4h8r32,1,0,8,0,5/1/16 6:57485,0:00:36,5/1/16 18:36,1,260,What do you silently judge people for?,"384 days, 18:40:52",7,4h9kc3,1,0,8,0,5/1/16 10:364131,0:00:15,5/1/16 16:24,0,4452,What's something completely normal that's actually really weird if you think about it?,"917 days, 5:46:36",13,4h901q,1,0,9,0,5/1/16 8:2446,0:00:52,5/1/16 21:50,1,9960,"Reddditors who have had sex with famous people, what was the best and worst part after the experience?","293 days, 17:07:57",18,4haoo5,1,1,5,0,5/1/16 13:5091,0:12:15,5/1/16 22:51,0,452,You can wish some kind of tiny convenience onto someone (e.g. good hair first try) what do you wish onto them and who receives it?,"398 days, 11:31:04",25,4hb2y1,1,0,0,0,5/1/16 14:51132,0:27:42,5/4/16 15:15,0,665,"Lawyers of Reddit, what is the most outrageous case someone has asked you to take?","210 days, 5:07:07",15,4hu6w2,1,0,0,0,5/4/16 7:151,0:00:31,5/4/16 14:13,0,1427,What is a good health practice everyone should get into?,"1035 days, 10:26:52",10,4htzwc,1,0,6,0,5/4/16 6:1311,0:00:36,5/4/16 13:39,0,6565,What have you actually learned from playing video games?,"1211 days, 0:34:42",9,4htwjz,1,0,9,0,5/4/16 5:394402,0:00:54,5/4/16 13:39,1,58520,Which actors name says to you 'this movie is going to suck!' ?,"1712 days, 20:26:58",13,4htwlv,1,0,11,0,5/4/16 5:391,0:01:25,5/4/16 22:46,0,156,What epic MOVIE scene still gives you the chills?,"51 days, 1:11:49",9,4hw9ct,1,0,7,0,5/4/16 14:461,0:00:34,5/4/16 17:24,0,331,What do Western people think is most crazy about Chinese culture?,0:24:25,11,4huoym,1,0,8,0,5/4/16 9:2424,0:00:50,5/4/16 16:37,1,92,What's the most hilarious misheard lyric?,"1493 days, 19:28:21",6,4huhuf,1,0,9,0,5/4/16 8:371,0:01:44,5/4/16 23:08,0,1,What did you learn from your first real relationship?,"25 days, 2:28:22",9,4hwd8g,1,0,3,0,5/4/16 15:08572,0:01:08,5/4/16 17:37,0,27623,What are some Excel tricks that are useful for work?,"244 days, 18:36:04",10,4huqyn,1,0,3,0,5/4/16 9:37729,0:00:35,5/4/16 3:29,0,5985,How would life be different if everyone had a ticker on their forehead that tracks the number of days since they last had sex?,"1240 days, 22:48:50",24,4hrvnd,1,1,12,0,5/3/16 19:2913,0:01:37,5/4/16 17:29,0,388,"If you could have one minor superpower to make everyday life a bit easier, what would it be?","344 days, 11:51:16",18,4hupoq,1,0,4,0,5/4/16 9:295430,0:01:20,5/4/16 10:56,0,5370,"Pilots of Reddit, what's the strangest thing you've seen from the air?","734 days, 17:53:22",12,4htib6,1,0,2,0,5/4/16 2:568062,0:00:42,5/4/16 21:19,1,12744,How would things be different if Harry Potter was born in the US instead of England?,"246 days, 23:51:32",16,4hvuan,1,0,9,0,5/4/16 13:191,0:16:48,5/4/16 17:39,0,31,"Delivery men/women of Reddit, what is the strangest or creepiest thing you've encountered on the job?",12:54:13,16,4hur95,1,0,0,0,5/4/16 9:39319,0:00:41,5/4/16 23:29,1,2572,"What is your Go-To mixed drink, and how you prepare it?","493 days, 19:36:16",11,4hwgni,1,0,8,0,5/4/16 15:291,0:00:33,5/4/16 21:34,1,31,"If you could prevent one fictional character from dying, who would it be and why?","1070 days, 17:24:41",15,4hvx6t,1,0,5,0,5/4/16 13:341303,0:00:40,5/4/16 16:07,1,201877,"Besides veganism and CrossFit, what do people blab about constantly that drives you batshit crazy?","1820 days, 9:58:15",15,4hudj3,1,0,12,0,5/4/16 8:071,0:01:57,5/4/16 23:49,0,30,"People who've married twice or more, what was different the next time round?","36 days, 21:57:15",13,4hwk0k,1,0,4,0,5/4/16 15:4954,0:00:25,5/5/16 0:04,1,10824,What mini superpower would you want for your pet?,"38 days, 5:11:45",9,4hwmn7,1,0,5,0,5/4/16 16:041,0:00:59,5/4/16 19:56,0,0,What's the best feeling you have ever experienced?,"20 days, 14:52:54",8,4hvf8r,1,0,3,0,5/4/16 11:565199,0:00:34,5/4/16 18:16,1,692,What's the most frustrating feeling?,"493 days, 7:51:32",5,4huxco,1,0,11,0,5/4/16 10:16667,0:01:05,5/5/16 1:02,0,735,Which actor was perfectly cast for the role they were playing?,"765 days, 14:03:49",11,4hwvyr,1,0,13,0,5/4/16 17:0214,0:00:47,5/4/16 18:22,0,0,What is your favorite euphemism for sex?,"322 days, 18:32:55",7,4huyh9,1,1,7,0,5/4/16 10:2227,0:00:54,5/5/16 1:06,0,82,What do you miss about being a kid?,"504 days, 8:02:30",8,4hwwnm,1,0,6,0,5/4/16 17:061,0:00:27,5/3/16 23:53,0,714,All doors are now permanently open. What do you do first?,"33 days, 22:18:28",11,4hq8l7,1,0,10,0,5/3/16 15:538533,0:46:17,5/1/16 20:00,0,12524,"Relatives of murderers, what memories stand out as red flags?","828 days, 4:02:07",10,4ha0er,1,0,0,0,5/1/16 12:0072,0:01:42,5/1/16 15:38,0,1023,What's the funniest gross pick-up line you can think of?,"586 days, 17:26:51",10,4h8v5i,1,0,4,0,5/1/16 7:381,0:00:27,5/1/16 13:43,0,23,What quote do you live by?,"30 days, 13:00:56",6,4h8l5z,1,0,7,0,5/1/16 5:432378,0:01:55,5/1/16 11:51,0,2931,What huge thing happened that almost no one knows about?,"262 days, 22:11:23",10,4h8d11,1,0,2,0,5/1/16 3:51350,0:02:09,5/1/16 16:18,0,567,What is a book everyone must read?,"964 days, 0:59:26",7,4h8zag,1,0,4,0,5/1/16 8:1869,0:00:00,5/1/16 22:49,0,868,What are some good brands to avoid due to bad ethics?,"542 days, 8:10:21",11,4hb2nk,1,0,3,1,5/1/16 14:491012,0:01:43,5/1/16 15:45,0,87,what is your favorite smell?,"1217 days, 15:35:38",5,4h8vtk,1,0,9,0,5/1/16 7:451205,0:00:22,5/1/16 14:06,0,1150,What's one trend you hope dies within this year?,"344 days, 17:14:38",9,4h8mxk,1,0,13,0,5/1/16 6:061730,0:00:41,4/30/16 23:30,1,2854,"What joke is hilarious, but takes a few seconds to get?","89 days, 23:28:35",11,4h629u,1,0,5,0,4/30/16 15:301,0:00:22,5/1/16 17:53,0,4619,What sports would be much more interesting if all the participants have to take 7 shots of vodka before starting?,"197 days, 3:16:33",20,4h9cnu,1,0,9,0,5/1/16 9:53755,0:00:14,5/1/16 15:48,1,2080,What's the best non-sexual feeling in the world?,"21 days, 13:44:12",8,4h8w3x,1,1,15,0,5/1/16 7:4811,0:00:56,5/1/16 10:46,0,404,"""If you could call yourself five years ago and had 30 seconds, what would you say?""","44 days, 22:07:49",16,4h883u,1,0,6,0,5/1/16 2:461789,0:01:08,5/1/16 1:43,0,24192,"Women of reddit, what are the ways you show men you're interested?","695 days, 0:47:16",12,4h6kt9,1,0,6,0,4/30/16 17:436482,0:00:13,5/1/16 21:09,0,14749,What was the worst fast food chain you've eaten at?,"154 days, 10:06:20",10,4haf8d,1,0,7,0,5/1/16 13:0959,0:00:33,5/1/16 21:32,0,335,How do you beat loneliness?,"298 days, 18:48:34",5,4hakda,1,0,10,0,5/1/16 13:321,0:00:47,5/1/16 0:45,1,669,What's the farthest you've gone to impress a crush?,"148 days, 18:58:29",9,4h6cu1,1,0,10,0,4/30/16 16:451,0:01:46,5/1/16 20:48,0,128,"If subreddits were people, which two would have the most interesting fight to the death?","31 days, 19:13:53",15,4haaqk,1,0,1,0,5/1/16 12:481594,0:00:44,5/1/16 21:51,0,876,What's the biggest mistake people make when studying for an exam?,"452 days, 17:42:43",11,4hap3q,1,0,4,0,5/1/16 13:51337,0:00:07,5/1/16 10:04,0,7016,AskReddit announces an unoriginality contest. What do you post/comment in order to win?,"63 days, 3:03:48",13,4h8502,1,0,5,0,5/1/16 2:047,0:00:32,5/1/16 14:57,0,743,"Men of reddit, what are the ways you show women you're interested?","818 days, 4:26:54",12,4h8r32,1,0,8,0,5/1/16 6:57485,0:00:36,5/1/16 18:36,1,260,What do you silently judge people for?,"384 days, 18:40:52",7,4h9kc3,1,0,8,0,5/1/16 10:364131,0:00:15,5/1/16 16:24,0,4452,What's something completely normal that's actually really weird if you think about it?,"917 days, 5:46:36",13,4h901q,1,0,9,0,5/1/16 8:2446,0:00:52,5/1/16 21:50,1,9960,"Reddditors who have had sex with famous people, what was the best and worst part after the experience?","293 days, 17:07:57",18,4haoo5,1,1,5,0,5/1/16 13:5091,0:12:15,5/1/16 22:51,0,452,You can wish some kind of tiny convenience onto someone (e.g. good hair first try) what do you wish onto them and who receives it?,"398 days, 11:31:04",25,4hb2y1,1,0,0,0,5/1/16 14:51