author_link_karma,time_to_first_comment,post_localTime,question_type,author_comment_karma,title,author_account_age,title_length,post_id,hot,nsfw,10min_comment,serious,post_utcTime,author_gold
69803,0:00:46,2016-05-16 04:59:20,0,260615,Announcing our contest winner and some other stuff,"1690 days, 19:05:16",8,4jj45x,1,0,3,0,2016-05-15 20:59:20,1
19,0:00:28,2016-05-23 15:26:46,5,1176,What is a hobby you can get into for almost no money?,"158 days, 16:24:08",12,4knolu,1,0,6,0,2016-05-23 07:26:46,1
152,0:00:39,2016-05-23 15:42:39,5,17,"What is your favorite ""little known fact"" about history?","55 days, 4:26:52",9,4knqq5,1,0,11,0,2016-05-23 07:42:39,0
810,0:02:34,2016-05-23 09:08:14,5,182,Mathematicians of reddit - What is the hardest mathematical problem that we as humans have been able to solve?,"379 days, 16:09:13",19,4kmlfn,1,0,1,0,2016-05-23 01:08:14,0
11,0:00:14,2016-05-23 03:07:50,5,35978,What is the most unattractive thing in porn?,"420 days, 8:08:09",8,4kl9ku,1,1,14,0,2016-05-22 19:07:50,0
3923,0:02:16,2016-05-23 13:59:48,5,28939,"If AskReddit existed in the 1920s, what questions would have been asked?","1273 days, 19:07:09",12,4knes6,1,0,7,0,2016-05-23 05:59:48,0
1,0:00:43,2016-05-23 02:15:48,5,8,What movie currently on Netflix is a hidden gem?,"1601 days, 19:40:27",9,4kl1y7,1,0,1,0,2016-05-22 18:15:48,0
8805,0:01:00,2016-05-23 15:52:05,5,11148,What is totally normal in your country that would be really bizarre to foreigners/tourists?,"392 days, 13:49:04",14,4kns1h,1,0,9,0,2016-05-23 07:52:05,0
1,0:00:22,2016-05-23 16:40:04,5,15,What was your most recent crime?,0:48:28,6,4knz3a,1,0,9,0,2016-05-23 08:40:04,0
35,0:00:31,2016-05-22 18:49:09,5,812,What was cool in 5000 B.C. that's still cool now?,"47 days, 13:58:06",10,4kj33t,1,0,11,0,2016-05-22 10:49:09,0
1447,0:00:39,2016-05-23 10:27:50,5,19768,What is your favorite song that's not in English?,"903 days, 11:10:59",9,4kmu1p,1,0,15,0,2016-05-23 02:27:50,0
73646,0:01:55,2016-05-23 14:33:23,5,36557,What is a concept that we live with that both our grandparents and grandchildren wouldn't/won't understand?,"847 days, 23:13:35",16,4knida,1,0,4,0,2016-05-23 06:33:23,1
1,0:00:47,2016-05-22 23:12:11,5,541,What fictional death will you never get over?,"284 days, 22:54:12",8,4kk95d,1,0,13,0,2016-05-22 15:12:11,0
102,0:13:58,2016-05-22 16:46:42,6,5851,Which 4Chan or Reddit thread is the creepiest?,"500 days, 4:15:36",8,4kim2f,1,1,0,0,2016-05-22 08:46:42,1
16617,0:00:55,2016-05-23 16:45:00,5,61226,What is something you always wanted to ask the opposite sex but can't do in person?,"690 days, 1:25:42",16,4knzv3,1,1,4,0,2016-05-23 08:45:00,1
229,0:00:22,2016-05-23 18:29:09,5,5685,"What do you want to hate, but can't?","2094 days, 23:33:18",8,4kohbk,1,0,6,0,2016-05-23 10:29:09,1
1,0:00:40,2016-05-22 21:01:18,5,5584,What songs are significantly more famous because they were in movies?,"216 days, 21:42:09",11,4kjnvm,1,0,2,0,2016-05-22 13:01:18,0
1,0:01:18,2016-05-23 15:23:36,3,56814,When we make a mistake in the US or Canada we say 'Oops'. Redditors outside of N.A. what do you folks says when you make a stupid mistake?,"349 days, 0:26:18",28,4kno66,1,0,6,0,2016-05-23 07:23:36,0
1,0:04:14,2016-05-22 20:34:30,5,4177,What are some big scandals that happened in Reddit?,"41 days, 22:50:14",9,4kjjkq,1,0,2,0,2016-05-22 12:34:30,1
185,0:17:37,2016-05-23 00:05:57,5,1230,What was your creepy unexplained experience as a child?,"576 days, 8:28:54",9,4kki0p,1,0,0,0,2016-05-22 16:05:57,1
1,0:00:43,2016-05-23 06:29:09,1,22,"Redditors who are happy, what are things or habits that make that so?","98 days, 11:13:20",13,4km1p1,1,0,9,0,2016-05-22 22:29:09,0
1,0:00:12,2016-05-23 17:55:11,5,529,what's your favourite word?,"49 days, 23:21:11",4,4kobcr,1,0,13,0,2016-05-23 09:55:11,0
27,0:00:36,2016-05-23 17:15:40,5,7621,"What movie did you think was a masterpiece the first time you watched it, only to think it was crap on the second viewing?","103 days, 20:43:52",24,4ko4qd,1,0,5,0,2016-05-23 09:15:40,0
3,0:01:04,2016-05-22 14:07:28,5,19895,Reddit is having a garage sale. What is each subreddit selling?,"441 days, 16:43:42",11,4ki54b,1,0,4,0,2016-05-22 06:07:28,1
238,0:00:33,2016-05-23 15:48:29,5,9,"What is an item that you need to buy, long before you actually use it?","161 days, 8:26:57",15,4knrk2,1,0,6,0,2016-05-23 07:48:29,0
1,0:00:00,2016-05-23 00:57:42,5,1609,"Redditors: What is the spookiest, most disturbing, or downright unexplainable thing you've ever found in the woods?","270 days, 20:35:32",17,4kkqab,1,0,2,1,2016-05-22 16:57:42,1
