author_link_karma,time_to_first_comment,post_localTime,question_type,author_comment_karma,title,author_account_age,title_length,post_id,hot,nsfw,10min_comment,serious,post_utcTime,author_gold
69236,0:00:46,2016-05-16 04:59:20,0,259930,Announcing our contest winner and some other stuff,"1690 days, 19:05:16",8,4jj45x,1,0,3,0,2016-05-15 20:59:20,1
15093,0:01:03,2016-05-18 14:45:03,5,6774,What absolutely fascinates you and why?,"1782 days, 11:44:27",6,4jw8zs,1,0,2,0,2016-05-18 06:45:03,0
55,0:00:58,2016-05-18 15:21:32,5,357,"What song, when played, makes you appreciate life and makes you feel at peace?","647 days, 12:38:00",14,4jwdsw,1,0,10,0,2016-05-18 07:21:32,0
4297,0:00:33,2016-05-18 15:50:51,5,988,"What wasn't cool 20 years ago, but is now?","801 days, 22:49:16",9,4jwi0t,1,0,10,0,2016-05-18 07:50:51,0
1,0:00:34,2016-05-18 23:00:28,5,2064,What question can you ask someone to immediately cause them to panic?,"418 days, 3:36:12",12,4jymdh,1,0,12,0,2016-05-18 15:00:28,1
209,0:00:16,2016-05-18 14:46:27,5,739,What film should never get a sequel?,"990 days, 13:58:48",7,4jw950,1,0,6,0,2016-05-18 06:46:27,0
1,0:00:26,2016-05-19 00:49:46,5,0,What classic movie would bomb if released today?,"14 days, 1:13:51",8,4jz5tr,1,0,4,0,2016-05-18 16:49:46,0
2424,0:00:18,2016-05-18 11:36:56,5,8408,What do most people do too late?,"333 days, 22:45:01",7,4jvp0x,1,0,6,0,2016-05-18 03:36:56,0
851,0:01:02,2016-05-19 02:26:52,5,13509,What was the worst meal that you ate out of politeness?,"2025 days, 6:20:33",11,4jzltd,1,0,2,0,2016-05-18 18:26:52,0
882,0:00:00,2016-05-18 20:33:24,5,3446,"Recruiters/employers of Reddit, what are some red flags on resumes that you will NOT hire people if you see?","1188 days, 0:19:48",19,4jxupe,1,0,3,0,2016-05-18 12:33:24,0
193172,0:01:34,2016-05-18 15:29:47,5,19316,What is the most traumatizing incident you have witnessed in real life?,"446 days, 22:25:30",12,4jwexq,1,1,4,0,2016-05-18 07:29:47,0
665,0:00:50,2016-05-18 14:45:22,5,4811,What is the most random thing someone has said to you during sex?,"87 days, 10:48:07",13,4jw90v,1,1,13,0,2016-05-18 06:45:22,0
1,0:01:19,2016-05-18 14:21:06,5,570,What item are you thankful is underpriced?,"130 days, 18:45:25",7,4jw61z,1,0,5,0,2016-05-18 06:21:06,0
1,0:00:47,2016-05-18 03:36:01,5,10,What is much more serious than people realize?,"666 days, 1:10:09",8,4ju1qm,1,0,12,0,2016-05-17 19:36:01,0
4,0:00:00,2016-05-18 22:53:01,5,747,"TV watchers of Reddit, what show could you just NOT get into?","33 days, 17:41:31",12,4jyl1e,1,0,14,1,2016-05-18 14:53:01,1
19,0:00:40,2016-05-19 03:47:01,5,779,What is something you are paranoid about?,"154 days, 4:44:23",7,4jzxst,1,0,3,0,2016-05-18 19:47:01,1
64642,0:00:31,2016-05-19 02:13:14,6,33224,If animals could talk which animal would have the coolest personality?,"1321 days, 7:58:09",11,4jzjpo,1,0,6,0,2016-05-18 18:13:14,1
65,0:02:13,2016-05-18 16:03:45,5,797,What is the most B.S. catchphrase and why?,"70 days, 23:49:01",8,4jwjtx,1,0,5,0,2016-05-18 08:03:45,1
67,0:00:43,2016-05-18 16:52:05,5,41,What social taboos shouldn't be taboo?,"1433 days, 19:59:33",6,4jwr3t,1,0,5,0,2016-05-18 08:52:05,1
448,0:00:24,2016-05-18 21:04:40,5,41372,What job do you have zero experience in but are confident you could do successfully?,"1274 days, 18:24:51",15,4jy0ku,1,0,7,0,2016-05-18 13:04:40,0
573,0:00:18,2016-05-19 02:46:37,5,1213,"If you had to eat 75 of one food in one sitting, what food would it be?","1197 days, 3:40:24",17,4jzouu,1,0,14,0,2016-05-18 18:46:37,0
33610,0:00:58,2016-05-19 03:36:30,5,22240,What is one thing EVERYONE is waiting for?,"534 days, 2:25:48",8,4jzw9f,1,0,10,0,2016-05-18 19:36:30,1
13,0:00:45,2016-05-19 03:17:40,5,0,What will you never understand no matter how many times someone explains it to you?,"130 days, 3:02:16",15,4jzti5,1,0,4,0,2016-05-18 19:17:40,0
18,0:01:15,2016-05-18 23:46:55,5,928,What are the worst movie quotes you can say during sex?,"704 days, 14:47:53",11,4jyutx,1,1,6,0,2016-05-18 15:46:55,0
5455,0:00:32,2016-05-18 22:41:31,5,2644,What item completely changed your way of life after you found out about it?,"1526 days, 16:23:50",14,4jyiu4,1,0,3,0,2016-05-18 14:41:31,0
82,0:01:03,2016-05-18 16:27:27,5,4370,What's something that seems like total bullshit to you?,"174 days, 5:20:44",9,4jwnbz,1,0,4,0,2016-05-18 08:27:27,1
